key,응시년도,모의고사,문항번호,문장번호,문장
353,2023,9,39,6,Critics are often interested in the ways artists exploit different kinds of materials and tools for particular artistic effect.
354,2023,9,39,7,They are also interested in the success of an artist’s attempt - embodied in the artwork itself - to push the limits of what can be achieved with certain materials and tools.
355,2023,9,40,1,"Research for historical fiction may focus on under-documented ordinary people, events, or sites."
356,2023,9,40,2,"Fiction helps portray everyday situations, feelings, and atmosphere that recreate the historical context"
357,2023,9,40,3,"Historical fiction adds “flesh to the bare bones that historians are able to uncover and by doing so provides an account that while not necessarily true provides a clearer indication of past events, circumstances and cultures.”"
358,2023,9,40,4,"Fiction adds color, sound, drama to the past, as much as it invents parts of the past."
359,2023,9,40,5,"And Robert Rosenstone argues that invention is not the weakness of films, it is their strength."
360,2023,9,40,6,Fiction can allow users to see parts of the past that have never - for lack of archives - been represented.
361,2023,9,40,7,"In fact, Gilden Seavey explains that if producers of historical fiction had strongly held the strict academic standards, many historical subjects would remain unexplored for lack of appropriate evidence."
362,2023,9,40,8,"Historical fiction should, therefore, not be seen as the opposite of professional history, but rather as a challenging representation of the past from which both public historians and popular audiences may learn."
363,2023,9,41-42,1,One reason we think we forget most of what we learned in school is that we underestimate what we actually remember
364,2023,9,41-42,2,"Other times, we know we remember something, but we don’t recognize that we learned it in school."
365,2023,9,41-42,3,"Knowing where and when you learned something is usually called context information, and context is handled by different memory processes than memory for the content."
366,2023,9,41-42,4,"Thus, it’s quite possible to retain content without remembering the context."
367,2023,9,41-42,5,"For example, if someone mentions a movie and you think to yourself that you heard it was terrible but can’t remember where you heard that, you’re recalling the content, but you’ve lost the context."
368,2023,9,41-42,6,"Context information is frequently easier to forget than content, and it’s the source of a variety of memory illusions."
369,2023,9,41-42,7,"For instance, people are unconvinced by a persuasive argument if it’s written by someone who is not very credible."
370,2023,9,41-42,8,"But in time, readers’ attitudes, on average, change in the direction of the persuasive argument."
371,2023,9,41-42,9,Because readers are likely to remember the content of the argument but forget the source - someone who is not credible
372,2023,9,41-42,10,"If remembering the source of knowledge is difficult, you can see how it would be challenging to conclude you don’t remember much from school."
373,2023,9,43-45,1,"In July, people in the city often escaped to relax in the mountains."
374,2023,9,43-45,2,"Sean didn’t yet know it, but he was about to have the experience of a lifetime."
375,2023,9,43-45,3,"“When I look around, all I see is the work I haven’t finished and the bills I haven’t paid,” he complained over the phone to his friend and doctor, Alex."
376,2023,9,43-45,4,"Concerned about Sean, he said, “You’ve been stressed for weeks. Come see me for medical treatment if things don’t improve.”"
377,2023,9,43-45,5,"Upon hearing this offer, Sean replied, “Thanks, but I know just the treatment I need.”"
378,2023,9,43-45,6,He told his friend about the Vincent Mountain hike he had read about.
379,2023,9,43-45,7,"Alex anxiously warned, “Even in the summer, hiking can be dangerous"
380,2023,9,43-45,8,Don’t forget your safety checklist.”
381,2023,9,43-45,9,"Following his friend’s words, he added protective gear to his camping equipment."
382,2023,9,43-45,10,Sean put on his hiking clothes and tied up his boots.
383,2023,9,43-45,11,"He almost forgot his new hiking sticks as he walked out the door with his dog, Toby."
384,2023,9,43-45,12,"Having hiked for several hours, Sean was thrilled to reach the top of Vincent Mountain."
385,2023,9,43-45,13,"As Toby started to bark, Sean turned around and found him running toward a large pond."
386,2023,9,43-45,14,"“What a nice, quiet place,” Sean whispered to himself"
387,2023,9,43-45,15,"Among the trees, he could ease the stress of recent weeks."
388,2023,9,43-45,16,"As night approached, however, the wind blew fiercely"
389,2023,9,43-45,17,Sean became nervous.
390,2023,9,43-45,18,"Unable to sleep, he called to his companion, “Come here, Boy!”"
391,2023,9,43-45,19,He held the dog close in an effort to ignore the fear rushing in.
392,2023,9,43-45,20,"After what felt like the longest night of Sean’s life, the sky finally turned a beautiful shade of pink, and the warm sun shone around him."
393,2023,9,43-45,21,"He packed up his equipment, enjoying his last moments in the mountain air."
394,2023,9,43-45,22,"Finding Toby energetically running next to the campsite, Sean said, “You must be as excited as I am after surviving a night like that!”"
395,2023,9,43-45,23,"Sean went down the mountain with a renewed sense of joy, and he exclaimed, “My treatment worked like a charm!”"
,,,,,
